<?xml version="1.0" encoding="UTF-8"?>
<campbell_message xmlns:campbell="http://www.isi.edu/expect/scec/campbell" xmlns:xsi="http://www.w3.org/2001/XMLSchema-instance" xsi:noNamespaceSchemaLocation="campbellmessage.xsd">
	<ground_motion_param>0.1-sec SA</ground_motion_param>
	<magnitude_of_earthquake>8</magnitude_of_earthquake>
	<distance_from_site>50</distance_from_site>
	<depth_of_basin>50</depth_of_basin>
	<fault_type>normal</fault_type>
	<site_type>hard rock</site_type>
	<uncertainties>none</uncertainties>
</campbell_message>
